service_category,service_type,price,duration,description
Spa,Massage,400000,60 minutes,"Full body relaxation massage, helps reduce stress and fatigue"
Spa,Hot Stone,500000,75 minutes,"Hot stone massage, improves blood circulation and relaxes muscles"
Spa,Aromatherapy,450000,60 minutes,"Natural essential oil massage, brings a feeling of relaxation and mental freshness"
Food,Buffet,200000,120 minutes,"Diverse Asian – European buffet, includes vegetarian dishes and seafood"
Food,A la carte,150000,90 minutes,"À la carte menu upon request, served at the table"
Laundry,Standard,80000,24 hours,"Regular wash, gentle clothes handling, basic drying and ironing"
Laundry,Express,120000,6 hours,"Fast washing, same-day clothes pickup, includes careful ironing"